ISIN,SYMBOL,COMPANY_NAME_NSE,COMPANY_NAME_SCREENER,MATCH_SCORE,MATCH_STATUS,LAST_UPDATED
,UMESLTD,Usha Martin Education & Solutions Limited,RNIT AI Solution,59.57,UNMATCHED,2026-06-07
,UNICHEMLAB,Unichem Laboratories Limited,Zim Laboratories,83.33,REVIEW,2026-06-07
,UNIDT,United Drilling Tools Limited,United Drilling,83.33,REVIEW,2026-06-07
,UNIECOM,Unicommerce Esolutions Limited,Boston Commerce,70.27,UNMATCHED,2026-06-07
,UNIENTER,Uniphos Enterprises Limited,Uniphos Enter.,81.25,REVIEW,2026-06-07
,UNIINFO,Uniinfo Telecom Services Limited,Uniinfo Telecom,76.92,REVIEW,2026-06-07
,UNIMECH,Unimech Aerospace and Manufacturing Limited,Unimech Aero.,51.06,UNMATCHED,2026-06-07
,UNIONBANK,Union Bank of India,Bank of India,81.25,REVIEW,2026-06-07
,UNITEDPOLY,United Polyfab Gujarat Limited,United Polyfab,77.78,REVIEW,2026-06-07
,UNITEDTEA,The United Nilgiri Tea Estates Company Limited,United Nilgiri,63.64,UNMATCHED,2026-06-07
,UNIVPHOTO,Universus Photo Imagings Limited,Universus Photo,76.92,REVIEW,2026-06-07
,URAVIDEF,Uravi Defence and Technology Limited,Uravi Defence &,63.41,UNMATCHED,2026-06-07
,USK,Udayshivakumar Infra Limited,Udayshivakumar,82.35,REVIEW,2026-06-07
,UTIAMC,UTI Asset Management Company Limited,NIS Management,70.59,UNMATCHED,2026-06-07
,UTKARSHBNK,Utkarsh Small Finance Bank Limited,Utkarsh Small F.,73.17,UNMATCHED,2026-06-07
,UTLSOLAR,Fujiyama Power Systems Limited,Fujiyama Power,77.78,REVIEW,2026-06-07
,VADILALIND,Vadilal Industries Limited,Vama Industries,84.85,REVIEW,2026-06-07
,VEEDOL,Veedol Corporation Limited,Veedol Corporat,70.59,UNMATCHED,2026-06-07
,VENUSPIPES,Venus Pipes & Tubes Limited,Venus Pipes,78.57,REVIEW,2026-06-07
,VERANDA,Veranda Learning Solutions Limited,Veranda Learning,76.19,REVIEW,2026-06-07
,VETO,Veto Switchgears And Cables Limited,Veto Switchgears,74.42,UNMATCHED,2026-06-07
,VIDHIING,Vidhi Specialty Food Ingredients Limited,Vidhi Specialty,63.83,UNMATCHED,2026-06-07
,VIJAYA,Vijaya Diagnostic Centre Limited,Vijaya Diagnost.,76.92,REVIEW,2026-06-07
,VIKRAN,Vikran Engineering Limited,GTV Engineering,78.79,REVIEW,2026-06-07
,VINCOFE,Vintage Coffee And Beverages Limited,Vintage Coffee,66.67,UNMATCHED,2026-06-07
,VINYLINDIA,Vinyl Chemicals (India) Limited,Vinyl Chemicals,83.33,REVIEW,2026-06-07
,VISHWARAJ,Vishwaraj Sugar Industries Limited,Suraj Industries,76.19,REVIEW,2026-06-07
,VIVIANA,Viviana Power Tech Limited,Viviana Power,83.87,REVIEW,2026-06-07
,VLEGOV,VL E-Governance & IT Solutions Limited,VL E-Governance,69.77,UNMATCHED,2026-06-07
,VOLTAMP,Voltamp Transformers Limited,Volt.Transform.,82.35,REVIEW,2026-06-07
,VPRPL,Vishnu Prakash R Punglia Limited,Vishnu Prakash R,80.0,REVIEW,2026-06-07
,VRAJ,Vraj Iron and Steel Limited,Vraj Iron,64.29,UNMATCHED,2026-06-07
,VSSL,Vardhman Special Steels Limited,Vardhman Special,82.05,REVIEW,2026-06-07
,VSTL,Vibhor Steel Tubes Limited,Vibhor Steel,80.0,REVIEW,2026-06-07
,VSTTILLERS,V.S.T Tillers Tractors Limited,VST Till. Tract.,66.67,UNMATCHED,2026-06-07
,WAAREERTL,Waaree Renewable Technologies Limited,Defrail Technologies,65.31,UNMATCHED,2026-06-07
,WALCHANNAG,Walchandnagar Industries Limited,Mahan Industries,75.0,REVIEW,2026-06-07
,WCIL,Western Carriers (India) Limited,Western Carriers,84.21,REVIEW,2026-06-07
,WEALTH,Wealth First Portfolio Managers Limited,Wealth First Por,68.09,UNMATCHED,2026-06-07
,WEBELSOLAR,Websol Energy System Limited,Websol Energy,78.79,REVIEW,2026-06-07
,WELENT,Welspun Enterprises Limited,Welspun Enterp,84.85,REVIEW,2026-06-07
,WELINV,Welspun Investments and Commercials Limited,Welspun Investme,62.75,UNMATCHED,2026-06-07
,WELSPLSOL,Welspun Specialty Solutions Limited,Welspun Special.,71.43,UNMATCHED,2026-06-07
,WESTLIFE,WESTLIFE FOODWORLD LIMITED,Westlife Food,83.87,REVIEW,2026-06-07
,WEWORK,WeWork India Management Limited,Wework India,68.57,UNMATCHED,2026-06-07
,WIPL,The Western India Plywoods Limited,W I Plywoods,63.16,UNMATCHED,2026-06-07
,WSTCSTPAPR,West Coast Paper Mills Limited,West Coast Paper,84.21,REVIEW,2026-06-07
,XCHANGING,Xchanging Solutions Limited,Xchanging Sol.,81.25,REVIEW,2026-06-07
,XELPMOC,Xelpmoc Design And Tech Limited,Xelpmoc Design,75.68,REVIEW,2026-06-07
,XTGLOBAL,Xtglobal Infotech Limited,Meta Infotech,73.33,UNMATCHED,2026-06-07
,YATHARTH,Yatharth Hospital & Trauma Care Services Limited,Yatharth Hospit.,56.6,UNMATCHED,2026-06-07
,ZAGGLE,Zaggle Prepaid Ocean Services Limited,Zaggle Prepaid,65.12,UNMATCHED,2026-06-07
,ZEEL,Zee Entertainment Enterprises Limited,Zee Entertainmen,71.11,UNMATCHED,2026-06-07
,ZENITHSTL,Zenith Steel Pipes & Industries Limited,Texel Industries,66.67,UNMATCHED,2026-06-07
,ZFCVINDIA,ZF Commercial Vehicle Control Systems India Limited,Nirav Commercial,50.85,UNMATCHED,2026-06-07
,ZFSTEERING,ZF Steering Gear (India) Limited,Team India Guar.,64.86,UNMATCHED,2026-06-07
,ZODIACLOTH,Zodiac Clothing Company Limited,Zodiac Cloth. Co,80.0,REVIEW,2026-06-07
,ZSARACOM,Saraswati Commercial India Limited,Saraswati Commer,76.19,REVIEW,2026-06-07
,ZYDUSLIFE,Zydus Lifesciences Limited,Zydus Lifesci.,83.87,REVIEW,2026-06-07
